{
  "schema_version": "0.1",
  "status": { "state": "partial" },
  "request": {
    "backend": "auto",
    "strategy": null,
    "jobs": 1,
    "source_args": ["invoices/", "extra/logo.svg"]
  },
  "items": [
    {
      "source": {
        "path": "invoices/a.pdf",
        "relpath": "a.pdf",
        "filename": "a.pdf",
        "format": "pdf",
        "mime_type": "application/pdf",
        "size_bytes": 12345,
        "sha256": "aaaa1111"
      },
      "state": "succeeded",
      "response": {
        "schema_version": "0.3",
        "status": { "state": "succeeded" },
        "backend": { "id": "pymupdf", "type": "oss_library" },
        "document": { "text": "Invoice A total 100.00" }
      },
      "transport": "platform"
    },
    {
      "source": {
        "path": "invoices/b.pdf",
        "relpath": "b.pdf",
        "filename": "b.pdf",
        "format": "pdf",
        "sha256": "bbbb2222"
      },
      "state": "failed",
      "error": { "code": "backend_error", "message": "extraction timed out" }
    },
    {
      "source": {
        "path": "extra/logo.svg",
        "relpath": "logo.svg",
        "filename": "logo.svg",
        "format": "svg"
      },
      "state": "skipped",
      "skip_reason": "unsupported_format"
    }
  ],
  "summary": {
    "total": 3,
    "succeeded": 1,
    "failed": 1,
    "skipped": 1,
    "duration_ms": 4210,
    "cost_usd": null,
    "cost_bases": [],
    "pages_processed": 2,
    "backends": { "pymupdf": 1 }
  },
  "warnings": [
    { "code": "items_skipped", "message": "1 file skipped: unsupported_format (svg)" }
  ]
}
